,clean_text,class_types
501,i get the aluminum case for my new palm vx and it work really wellit have protect my handheld perfectly so far,Happy
502,very good product,Happy
503,mobile phone tool be must have,Happy
504,i be very impress with the job that motorola do on the sturdiness of this phone,Happy
505,i receive my order well within the ship timeframe,Happy
506,the phone be sturdy and waterproof,Happy
507,i be not impress with this and would not recommend this item to anyone,Unhappy
508,my only complaint be the standard sound volume be little low even when turn up to 5of 5,Unhappy
509,thank again to amazon for have the thing need for good price,Happy
510,i end up slide it on the edge of my pant or back pocket instead,Happy
511,i have to go to store and buy new nokia phone which be work great,Happy
512,work great,Happy
513,really ugly,Unhappy
514,horrible,Unhappy
515,the noise shield be incrediable,Happy
516,no real improvement,Unhappy
517,razr battery good buy,Happy
518,keep up the good work amazon,Happy
519,they refuse to refund or replace,Unhappy
520,unfortunately it easy to accidentally activate them with the gentletouch button if you accidentally touch the phone to your face while listen,Unhappy
521,so basically throw my money out the window for nothing,Unhappy
522,great case and price,Happy
523,all it take be one drop from about 6 inch above the kitchen counter and it be crackedi be not impress and be not laugh,Unhappy
524,bluetooth range be good few day ago leave my phone in the trunk,Happy
525,small,Happy
526,the eargels channel the sound directly into your ear and seem to increase the sound volume and clarity,Happy
527,none of the new one have ever quite work properly,Unhappy
528,i be glad purchase it,Happy
529,ive miss numerous call because of this reason,Unhappy
530,perhaps my phone be defective,Unhappy
531,dont buy this product,Unhappy
532,suck,Unhappy
533,no shift,Happy
534,bad software ever use if could give this zero star would,Unhappy
535,try to make call on these be an exercise in frustration,Unhappy
536,the case be flimsy piece of plastic and have no front or side protection whatsoever,Unhappy
537,i own jabra earset and be very happy with it,Happy
538,i love the camera,Happy
539,thank you for such great service,Happy
540,it total package,Happy
541,the seller be very understand and patient,Happy
542,i give wirefly happy stari will contact cingularatt,Unhappy
543,it aggravate,Unhappy
544,great product for the price,Happy
545,i have purchase these for both family and friend,Happy
546,virgin wireless rock and so do this cheap little phone,Happy
547,none of it work,Unhappy
548,muddy,Happy
549,please dont waste your money,Unhappy
550,all in all,Happy
551,if you be look for good quality motorola headset keep look,Unhappy
552,yet plantronincs continue to use the same flaw charger design,Unhappy
553,disapointing result,Unhappy
554,cumbersome design,Unhappy
555,great it be new package nice work good,Happy
556,great product,Happy
557,it piece of crap,Unhappy
558,my experience be terrible this be my fourth bluetooth headset,Unhappy
559,this fix all the problem,Happy
560,bad ever,Unhappy
561,i be very happy,Happy
562,ive have no trouble access the internet,Happy
563,i can barely ever hear on it and be constantly say what,Unhappy
564,the battery life be highly unacceptable,Unhappy
565,that company be joke,Unhappy
566,it do everything the description say it would,Happy
567,due to this happen on every call be force to stop use this headset,Unhappy
568,it work great with car charger,Happy
569,verizon tech support walk my through few procedure,Unhappy
570,voice quality,Unhappy
571,it play loud than any other speaker of this size,Happy
572,good than expect,Happy
573,it feel poorly construct,Unhappy
574,battery be hold up well,Happy
575,also difficult to put onid recommend avoid this product,Unhappy
576,i only use it two day,Unhappy
577,i get the car charger and not even after week the charger be brokeni go to plug it in and it start smoke,Unhappy
578,sprint terrible customer service,Unhappy
579,link to my phone without effort,Happy
580,they be so cool,Happy
581,easy to use,Happy
582,good than new,Happy
583,what possesed me to get this junk,Unhappy
584,piece of trash,Unhappy
585,a pretty good product,Happy
586,this be great phone,Happy
587,for the price on amazon,Happy
588,their research and development division obviously know what theyre do,Happy
589,the real killer be the volume,Unhappy
590,those phone be work just fine now,Happy
591,i be more than happy with this product,Happy
592,poor construction,Unhappy
593,this be infuriate,Unhappy
594,overall,Happy
595,sprint charge for this service,Unhappy
596,it be cheap,Unhappy
597,it fit my ear well and be comfortable on,Happy
598,it doesnt work in europe or asia,Unhappy
599,clip this to your belt will deffinitely make you feel like 5unhappy cent upandcoming,Happy
600,i like design and look of jabra behing the ear headset and 5unhappy2unhappy be pretty comfortible to wear 24 hour day without pain in the ear,Happy
601,i be amaze at the quick arrival of the two original lg cell phone battery and and at fraction of the price,Happy
602,the bad phone from samsungcrap this crappy samsung e7happy5 be the bad have ever seeen,Unhappy
603,the charger work for about week and then completely stop charge my phone,Unhappy
604,poor product,Unhappy
605,however need some good instruction,Unhappy
606,you need two hand to operate the screenthis software interface be decade old and can not compete with new software design,Unhappy
607,work very well pair with treo 7unhappyunhappyw and a skype headset on my pc use usb bluetooth transceiver,Happy
608,steer clear of this product and go with the genuine palm replacementr pen,Unhappy
609,do not buy do not buyit suck,Unhappy
610,this be great product sure beat use your finger,Happy
611,plus,Unhappy
612,all the other case ive try normally fall apart after few month but this one seem to be in for the long haul,Happy
613,very dissapointing performance,Unhappy
614,dont make the same mistake that do and please dont buy this phone,Unhappy
615,this phone might well be the bad ive ever have in any brand,Unhappy
616,case be more or le an extra that originally put on but late discard because it scratch my ear,Unhappy
617,i recommend igo to anyone with different brand cell phonesmp3 player in the family,Happy
618,dont bother go to the store,Unhappy
619,i do not have any problem with this item and would order it again if need,Happy
620,you get what you pay for guess,Unhappy
621,im surprise this be good quality car charger and there not much review about it,Happy
622,these be fabulous,Happy
623,i use bitpim free program you can find on the internetto transfer data to the phonethe price of the cable be excellent,Happy
624,disappoint accessory from good manufacturer,Unhappy
625,very windresistant,Happy
626,linksys should have some way to exchange bad phone for refurb unit or something,Unhappy
627,phone be sturdy a all nokia bar phone be,Happy
628,great phone,Happy
629,im please,Happy
630,battery be terrible,Unhappy
631,i find the product to be easy to set up and use,Happy
632,the earpiece on this be too large or too heavyit keep fall out of my ear,Unhappy
633,utter crap sound quality be terrible,Unhappy
634,talk about useless customer service,Unhappy
635,it felt too light and tinny,Unhappy
636,this do not fit the palm tungsten e2 and it break the first time try to plug it in,Unhappy
637,im happy about this purchase good quality and low price,Happy
638,i love the look and feel of samsung flipphones,Happy
639,it welldesigned and very sharp the blue be very nice color,Happy
640,do everything it should and more,Happy
641,i could not recommend these more,Unhappy
642,nice sound,Happy
643,much le than the jawbone be go to replace it with,Happy
644,setup go very smoothly,Happy
645,it extremely slow and take forever to do anything with it,Unhappy
646,a must study for anyone interest in the bad sin of industrial design,Unhappy
647,the first thing that happen be that the track be off,Unhappy
648,then have to continue pair it periodically since it somehow keep drop,Unhappy
649,cant upload ringtones from third party,Unhappy
650,truly awful,Unhappy
651,the volume for the ringer be real good you have choice how loud,Happy
652,and none of the tone be acceptable,Unhappy
653,camera color balance be awful,Unhappy
654,i love the ringtones because they be so upbeat,Happy
655,chinese forgery abound,Unhappy
656,easy to pair with my samsung cell,Happy
657,the instruction didnt explain that microphone jack could be use,Unhappy
658,i would advise to not purchase this item it never work very well,Unhappy
659,too bad you have to pay up to month for the service,Unhappy
660,work well,Happy
661,the nokia ca42 usb cable do not work with my phone,Unhappy
662,clear crisp sound,Happy
663,the design might be ergonomic in theory but could not stand have these in my ear,Unhappy
664,do not buy if you want to use the holster,Unhappy
665,the phone can also take great picture and even video clip,Happy
666,it doesnt make you look cool,Unhappy
667,you cant beat the price on these,Happy
668,lightweight and work well,Happy
669,so just beware,Unhappy
670,i love this cable it allow me to connect any miniusb device to my pc,Happy
671,so anyone near you will hear part of your conversation,Unhappy
672,this be cool because most case be just open there allow the screen to get all scratch up,Happy
673,i buy this phone a replacement for my startac and have regret it since,Unhappy
674,appear to actually outperform the original battery from china that come with my v325i,Happy
675,cant store anything but phone number to sim,Unhappy
676,poor quality,Unhappy
677,jabra ear gel the best,Happy
678,not worth it,Unhappy
679,the phone crash completely and now have to get it replace,Unhappy
680,it be great phone,Happy
681,if you simply want small flip phone look elsewhere a the extra bell whistle be mediocre,Unhappy
682,my phone doesnt slide around my car now and the grip prevent my phone from slip out of my hand,Happy
683,this be simply the best bluetooth headset for sound quality,Happy
684,think it over when you plan to own this onethis sure be the last moto phone for me,Unhappy
685,i have always use cord headset and the freedom from the wireless be very helpful,Happy
686,it have everything need and couldnt ask for more,Happy
687,after receive and use the product for just 2 day it break,Unhappy
688,this product be great it make work lot easy can go to the copier while wait on hold for something,Happy
689,none of the three size they send with the headset would stay in my ear,Unhappy
690,tmobile have the best customer service anywhere,Happy
691,arrive quickly and much le expensive than others be sell,Happy
692,we have try 2 unit and they both fail within 2 month pro,Unhappy
693,krussel always good,Happy
694,the design be very good4,Happy
695,i great reception all the time,Happy
696,i would highly recommend this product,Happy
697,it dit not work most of the time with my nokia 532unhappy,Unhappy
698,fantastic buy and will get again for whatever my next phone be,Happy
699,this blueant supertooth handsfree phone speaker be awesome,Happy
700,do not fit,Unhappy
701,item arrive quickly and work great with my metro pc samsung schr45unhappy slider phone and sony premium sound in ear plug,Happy
702,disappoint,Unhappy
703,blue ant be easy to use,Happy
704,cheap but hey it work be pleasantly suprised give the low cost of this item,Happy
705,the camera on the phone may be use a dustpan when indoors id rather be use disposable then this,Unhappy
706,then few day late the puff of smoke come out of the phone while in use,Unhappy
707,it very convenient and simple to use get job do make the car ride so much smooth,Happy
708,the nano state itmy son be dissapointed,Unhappy
709,the sound quality be excellent a well,Happy
710,it the best headset have use,Happy
711,would not reccommend,Unhappy
712,they have be around for year and carry the high quality of antiglare screen protector that have find to date,Happy
713,just what want,Happy
714,this particular model would not work with my motorola smartphone,Unhappy
715,wont work right or atleast for me,Unhappy
716,but now that it be out of warranty the same problem reoccurebottom line put your money somewhere else cingular will not support it,Unhappy
717,great product,Happy
718,crisp and clear,Happy
719,after the first charge keep go dead after happy2 minute,Unhappy
720,the reception have be generally good,Happy
721,great bluetooth,Happy
722,i highly recommend this case,Happy
723,worthwhile,Happy
724,this be great deal,Happy
725,i be sorry make this purchase,Unhappy
726,i buy these hop could make my bluetooth headset fit good but these thing make it impossible to wear,Unhappy
727,treo and tmobile refuse to replace it again and force me to buy another phone without any kind of upgrade discount,Unhappy
728,it be horrible,Unhappy
729,i dont think it would hold it too securly on your belt,Unhappy
730,this allow the possibility of double book for the same date and time after the first,Unhappy
731,they work about 2 week then break,Unhappy
732,it be simple to use and like it,Happy
733,i cant use this case because the smell be disgust,Unhappy
734,not what want,Unhappy
735,i own 2 of these case and would order another,Happy
736,great phone,Happy
737,i buy this battery with coupon from amazon and im very happy with my purchase,Happy
738,perfect for the ps3,Happy
739,a good quality bargain buy this after buy cheapy from big lot that sound awful and people on the other end couldnt hear me,Happy
740,5unhappy down the drain,Unhappy
741,i try talk real loud but shout on the telephone get old and be still tell it wasnt great,Unhappy
742,for the price this be great deal,Happy
743,yes it shiny on front side and love it,Happy
744,do not work,Unhappy
745,the reception through this headset be excellent,Happy
746,2 thumb up to this seller,Happy
747,improper description have to return it,Unhappy
748,happy it work 2 it be comfortable,Happy
749,battery chargelife be quite long,Happy
750,the jabra eargels fit my ear very well,Happy
751,battery have no life,Unhappy
752,i check everywhere and there be no feature for it which be really disappoint,Unhappy
753,product be exactly a describe,Happy
754,get signal when other verizon phone wont,Happy
755,doesnt do the job,Unhappy
756,i would recommend it,Happy
757,plan on order from them again and again,Happy
758,i have be very satisfy with this cell phone from day one,Happy
759,they keep get good and good this be my third one and ive have numerous palm too,Happy
760,awkward to use and unreliable,Unhappy
761,the ship time be also very quick,Happy
762,not a good a have hop,Unhappy
763,good case,Happy
764,doesnt work,Unhappy
765,really good product,Happy
766,unfortunately it do not work,Unhappy
767,all three break within two month of use,Unhappy
768,dont buy it,Unhappy
769,i dont like this nokia either,Unhappy
770,i have buy this nokia cell phone few week ago and it be nightmare,Unhappy
771,it would take too long to describe how bad my customer service experience have be with amazon,Unhappy
772,the only very disappoint thing be there be no speakerphone,Unhappy
773,terrible my car will not accept this cassette,Unhappy
774,it not what it say it be,Unhappy
775,stay away from the q,Unhappy
776,use and dirty,Unhappy
777,very unreliable service from tmobile,Unhappy
778,not good enough for the price,Unhappy
779,i buy two of them and neither will charge,Unhappy
780,it look very nice,Happy
781,i have read others review here but havent have any problem with it,Happy
782,these product cover up the important light sensor above the ear outlet,Unhappy
783,comfortable in my hand,Happy
784,just do not work,Unhappy
785,poor reliability,Unhappy
786,it work,Happy
787,last time buy from you,Unhappy
788,it be waste of my money,Unhappy
789,so far it have work like charm,Happy
790,would recommend this item,Happy
791,the item receive be counterfeit,Unhappy
792,work fine,Happy
793,i receive my headset in good time and be happy with it,Happy
794,i be very please to see that could replace my well travled swivel holster for my blackberry flip,Happy
795,my sister have one also and she love it,Happy
796,good quality,Happy
797,this be by far the bad purchase ive make on amazon,Unhappy
798,excellent dualpurpose headset,Happy
799,excellent,Happy
800,do not work for listen to music with the cingular 8happy25,Unhappy
801,have trouble with volume,Unhappy
802,the only good thing be that it fit comfortably on small ear,Happy
803,warn do not buy,Unhappy
804,best headset ever,Happy
805,dont trust their website and dont expect any helpful support,Unhappy
806,it be that loudglad to say that the plantronics 5happyunhappy maintain flawless connection to my cell and with no static during normal use,Happy
807,the speaker be of low quality so a make the ring tone sound very cheap,Unhappy
808,excellent product for the price,Happy
809,bad reception,Unhappy
810,this product be very high quality chinese crap,Unhappy
811,it be quite comfortable in the ear,Happy
812,great phone,Happy
813,dont buy this product it fail,Unhappy
814,everything about this product be wrongfirst,Unhappy
815,the pair of the two device be so easy it barely take couple minute before start make call with the voice dial feature,Happy
816,terrible phone holder,Unhappy
817,the cutout and button be place perfectly,Happy
818,i love be able to use one headset for both by landline and cell,Happy
819,problem be that the ear loop be make of weak material and break easily,Unhappy
820,not nearly a good look a the amazon picture make it look,Unhappy
821,how stupid be that,Unhappy
822,seller ship quickly and much cheap than the competitor,Happy
823,so buy about happyunhappy of these and save alot of money,Happy
824,it always cut out and make beep beep beep sound then say signal fail,Unhappy
825,couldnt figure it out,Unhappy
826,so have to take the battery out of the phone put it all back together and then restart it,Unhappy
827,leopard print be wonderfully wild,Happy
828,work for me,Happy
829,much good than the hard plastic case,Happy
830,it also have new problem,Unhappy
831,happy so far,Happy
832,cool phone,Happy
833,work good,Happy
834,motorola finally get the voice quality of bluetooth headset right,Happy
835,it loose connection to the phone even when it be within couple foot between the two,Unhappy
836,make it easy to keep up with my bluetooth when im not wear it,Unhappy
837,a say abovepretty useless,Unhappy
838,never get it,Unhappy
839,this pair of headphone be the bad that have ever have soundwise,Unhappy
840,down the drain because of weak snap,Unhappy
841,do not charge the cingular att 8525 phone,Unhappy
842,you get extra minute so that you can carry out the call and not get cut off,Happy
843,i keep catch the cable on the seat and have to pull the phone out to turn it on an off,Unhappy
844,the headset fulfill my requirement so be happy with my purchase,Happy
845,logitech bluetooth headset be happyunhappy,Happy
846,a lot of website have be rat this very good phone and so do i,Happy
847,i have try these cable with my computer and my ipod and it work just fine,Happy
848,im return them,Unhappy
849,i do not maintain connection with the computer while it be on my lap,Unhappy
850,it be easy to turn on and off when you be in the car and the volume control be quite accessable,Happy
851,i have have mine for about year and this christmas buy some for the rest of the family,Happy
852,nice leather,Happy
853,i have to purchase different case,Unhappy
854,it be joy to use,Happy
855,very much disappoint with this company,Unhappy
856,very satisifed with that,Happy
857,it didnt charge for me,Unhappy
858,this be the phone to get for 2unhappyunhappy5 just buy my s7happyunhappya and all can say be wow,Happy
859,button be too small,Unhappy
860,just read on the spec alone make you say wow,Happy
861,love it great armband,Happy
862,i really like this product over the motorola because it be allot clear on the ear piece and the mic,Happy
863,i exchange the sony ericson z5unhappyunhappya for this and im pretty happy with that decision,Happy
864,i be very impress with the price of the case,Happy
865,also make it easy to hold on to,Happy
866,it pretty easy,Happy
867,i can not make call at certain place,Unhappy
868,beautiful style though,Happy
869,this company charge me restock fee and still not give me my refund back,Unhappy
870,im try to return it for refund,Unhappy
871,i plug it in only to find out not darn thing work,Unhappy
872,excellent product,Happy
873,earbud piece break easily,Unhappy
874,lousy product,Unhappy
875,this phone try very hard to do everything but fail at it very ability to be phone,Unhappy
876,it be the best charger have see on the market yet,Happy
877,sweet phone,Happy
878,it fit so securely that the ear hook do not even need to be use and the sound be good direct through your ear canal,Happy
879,not enough volume,Unhappy
880,echo problemvery unsatisfactory,Unhappy
881,you could only take 2 video at time and the quality be very poor,Unhappy
882,dont waste your money,Unhappy
883,i be go to have to be the first to negatively review this product,Unhappy
884,adapter do not provide enough charge current,Unhappy
885,you also can not take picture with it in the case because the lense be cover,Unhappy
886,phone fall out easily,Unhappy
887,the text message feature be really tricky to use,Unhappy
888,im really disappoint all have now be charger that doesnt work,Unhappy
889,painful on the ear,Unhappy
890,last one day and then blow up,Unhappy
891,disappoint,Unhappy
892,kind of flop around,Unhappy
893,the screen do get smudge easily because it touch your ear and face,Unhappy
894,what piece of junk lose more call on this phone,Unhappy
895,item do not match picture,Unhappy
896,the only thing that disappoint me be the infra red port irda,Unhappy
