,clean_text,class_types
0,so there be no way for me to plug it in here in the u unless go by converter,Unhappy
1,good case,Unhappy
2,great for the jawbone,Happy
3,tie to charger for conversation last more than 45 minutesmajor problem,Unhappy
4,the mic be great,Happy
5,i have to jiggle the plug to get it to line up right to get decent volume,Unhappy
6,if you have several dozen or several hundred contact,Unhappy
7,if you be razr owneryou must have this,Happy
8,needle to say,Unhappy
9,what waste of money and time,Unhappy
10,and the sound quality be great,Happy
11,he be very impress when go from the original battery to the extend battery,Happy
12,if the two be seperated by mere 5 ft start to notice excessive static and garble sound from the headset,Unhappy
13,very good quality though,Happy
14,the design be very odd,Unhappy
15,highly recommend for any one who have blue tooth phone,Happy
16,i advise everyone do not be fool,Unhappy
17,so far so good,Happy
18,work great,Happy
19,it click into place in way that make you wonder how long that mechanism would last,Unhappy
20,i go on motorolas website and follow all direction,Unhappy
21,i buy this to use with my kindle fire and absolutely love it,Happy
22,the commercial be the most mislead,Unhappy
23,i have yet to run this new battery below two bar and thats three day without charge,Happy
24,i buy it for my mother and she have problem with the battery,Unhappy
25,great pocket pc phone combination,Happy
26,ive own this phone for 7 month now and can say that it the best mobile phone ive have,Happy
27,i didnt think that the instruction provide be helpful to me,Unhappy
28,people couldnt hear me talk and have to pull out the earphone and talk on the phone,Unhappy
29,doesnt hold charge,Unhappy
30,this be simple little phone to use,Unhappy
31,this product be ideal for people like me whose ear be very sensitive,Happy
32,it be unusable in move car at freeway speed,Unhappy
33,i have two more year leave in this contract and hate this phone,Unhappy
34,car charger a well a ac charger be include to make sure you never run out of juicehighy recommend,Happy
35,you need at least 3 min to get to your phone book from the time you first turn on the phonebattery life be short,Unhappy
36,it have keep up very well,Happy
37,poor talk time performance,Unhappy
38,the case be great and work fine with the 68unhappy,Happy
39,worthless product,Unhappy
40,it have great camera thats 2mp,Happy
41,i be not impress by this product,Unhappy
42,nice headset price right,Happy
43,i only hear garbage for audio,Unhappy
44,excellent bluetooth headset,Happy
45,it have all the feature want,Happy
46,who in their right mind be gon na buy this battery,Unhappy
47,after argue with verizon regard the drop call we return the phone after two day,Unhappy
48,this case seem well make,Happy
49,disappoint with battery,Unhappy
50,not loud enough and doesnt turn on like it should,Unhappy
51,good protection and do not make phone too bulky,Happy
52,a usable keyboard actually turn pda into realworld useful machine instead of just neat gadget,Happy
53,this phone be pretty sturdy and ive never have any large problem with it,Happy
54,i love this thing,Happy
55,everything about it be fine and reasonable for the price ie,Happy
56,very disappoint,Unhappy
57,i even drop this phone into stream and it be submerge for happy5 second and it still work great,Happy
58,i have be very happy with the 5happyunhappy and have have no complaint from any one regard my sound quality on their end,Happy
59,the button for on and off be bad,Unhappy
60,essentially you can forget microsofts tech support,Unhappy
61,these headphone be great find and think they be perhaps the best purchase ive make in the last several year seriously,Happy
62,buy different phone but not this,Unhappy
63,you have to hold the phone at particular angle for the other party to hear you clearly,Unhappy
64,the one big drawback of the mp3 player be that the button on the phone front cover that let you pause and skip song lock out after few second,Unhappy
65,it feel more comfortable than most headset because wear glass and that get in the way sometimes,Happy
66,great for ipod too,Happy
67,this device be great in several situationshappy,Happy
68,mic doesnt work,Unhappy
69,great choice,Happy
70,nice dock station for home or work,Happy
71,this be beautiful phone,Happy
72,love this product,Happy
73,do not buy for d8unhappy7wrongly advertise for d8unhappy7,Unhappy
74,this be great little item,Happy
75,i purchase this and within 2 day it be no long work,Unhappy
76,i wear it everyday and it hold up very well,Happy
77,not good bargain,Unhappy
78,the battery run down quickly,Unhappy
79,the headset be easy to use and everyone love them,Happy
80,this phone work great,Happy
81,the construction of the headset be poor,Unhappy
82,product be excellent and work good than the verizon one and boy be it cheap,Happy
83,the phone load super,Happy
84,make very sturdy,Happy
85,work great,Happy
86,the ear bud only play music in one ear,Unhappy
87,dont waste your money,Unhappy
88,will order from them again,Happy
89,if you plan to use this in car forget about it,Unhappy
90,i find this product to be waaay too big,Unhappy
91,best ive find so far ive try 2 other bluetooths and this one have the best quality for both me and the listener a well a ease of use,Happy
92,im very disappoint with my decision,Unhappy
93,integrate seamlessly with the motorola razr phone,Happy
94,buyer beware,Unhappy
95,definitely bargain,Happy
96,the price be very good and with the free ship and all it be good purchase,Happy
97,i receive my supposedly new motorola 375 and apparently there be not match between the phone and the charger,Unhappy
98,prosgood camera very nice picture,Happy
99,i love my 35unhappy headset my jabra35unhappy bluetooth headset be great,Happy
100,the camera,Unhappy
101,i purcashed this for the car charger and it do not work,Unhappy
102,sound quality on both end be excellent,Happy
103,this phone be slim and light and the display be beautiful,Happy
104,it little geeky but think thats it sex on toast and it rock and ooze sex right down to it battery embed sleek stylish leather case,Happy
105,great product,Happy
106,absolutely great,Happy
107,the keyboard be nice compromise between full qwerty and the basic cell phone number keypad,Happy
108,i get this phone around the end of may and im completely unhappy with it,Unhappy
109,it be very comfortable on the ear,Happy
110,it have be winner for u,Happy
111,setup couldnt have be simple,Happy
112,ive try several different earpiece for my cell phone and this jabra one be the first one ive find that fit my ear comfortably,Happy
113,could not get strong enough signal,Unhappy
114,iam very please with my purchase,Happy
115,bad quality,Unhappy
116,get the job do,Happy
117,great audio,Happy
118,basically the service be very bad,Unhappy
119,it do not work in my cell phone plug be very up set with the charger,Unhappy
120,ive only have my bluetooth for few week,Happy
121,the bt headset be such disapoinment,Unhappy
122,it be so small and you dont even realize that it be there after while of get use to it,Happy
123,the accompany software be almost brilliant,Happy
124,headset work great be package nicely to avoid any damage,Happy
125,i definitly recommend,Happy
126,buyerbe very careful,Unhappy
127,the majority of the logitech earbud headset fail,Unhappy
128,very good stuff for the price,Happy
129,my headset work just peachykeen,Happy
130,in my house be get drop coverage upstairs and no coverage in my basement,Unhappy
131,voice recognition be tremendous,Happy
132,what waste,Unhappy
133,during several different 2 minute call,Unhappy
134,i be not happy with this item,Unhappy
135,very disappoint,Unhappy
136,the phone take forever to charge like 2 to 5 hour literally,Unhappy
137,i get this phone on reccomendation from relative and im glad do,Happy
138,what waste of time,Unhappy
139,it reception be very very poor,Unhappy
140,item state a include from the description be not include,Unhappy
141,after 3 month,Unhappy
142,i be hop for more,Unhappy
143,audio quality be poor,Unhappy
144,i have absolutely no problem with this headset link to my 853unhappy blackberry curve,Happy
145,i know that sound funny,Happy
146,ive buy 5 wire headphone that sound good than these,Unhappy
147,this phone be very fast with send any kind of message and web browse be significantly fast than previous phone have use,Happy
148,nice quality build,Happy
149,this item be fantastic and work perfectly,Happy
150,and just love the color,Happy
151,w8happyunhappyi be just superb,Happy
152,all can do be whine on the internet,Unhappy
153,great charger,Happy
154,this be essentially communication tool that do not communicate,Unhappy
155,work like charm,Happy
156,i still maintain that monkey shouldnt make headphone,Unhappy
157,great value,Happy
158,doesnt work at all bougth it for my l7c and it not work,Unhappy
159,the look of it be very sharp and the screen be nice and clear,Happy
160,doesnt last long,Unhappy
161,one thing hate be the mode set button at the side,Unhappy
162,excellent service,Happy
163,thank you for waste my money,Unhappy
164,how can that bethe audio quality be poor,Unhappy
165,the igo charger and tip be really great,Happy
166,the file browser offer all the option that one needshandsfree be great,Happy
167,superb phone on great network,Happy
168,i connect my wife bluetooth,Happy
169,i put the late o on it vhappyhappy5g,Unhappy
170,it only recognize the phone a it storage device,Unhappy
171,if you like loud buzz to override all your conversation,Unhappy
172,dont buy this product,Unhappy
173,ive have this bluetoooth headset for some time now and still not comfortable with the way it fit on the ear,Unhappy
174,the sound quality be good and functionality be awesome,Happy
175,i have this phone and it be thorn in my side,Unhappy
176,i recently have problem where could not stay connect for more than happyunhappy minute before be disconnect,Unhappy
177,incredible,Happy
178,design flaw,Unhappy
179,great phone,Happy
180,waste of happy3 buck,Unhappy
181,but when check voice mail at night,Unhappy
182,the replacement die in few week,Unhappy
183,any ring toneoverall good phone to buy,Happy
184,lately they have be extremely nice and helpful on the phone,Happy
185,i have have problem wit hit drop signal and more,Unhappy
186,not impress,Unhappy
187,youll love how thin it be,Happy
188,bad choice,Unhappy
189,the pleather case doesnt fit,Unhappy
190,all in all think it be good investment,Happy
191,it make very strange tick noise before it end the call,Unhappy
192,the best electronics of the available fm transmitter,Happy
193,battery last only few hour,Unhappy
194,great headset,Happy
195,the happy2 mega pixel camera,Happy
196,ive have this for nearly 2 year and it have work great for me,Happy
197,good transmit audio,Happy
198,we be send it back,Unhappy
199,i do not bother contact the company for few dollar product but learn the lesson that should not have buy this form online anyway,Unhappy
200,if you hate earbugs,Unhappy
201,great price also,Happy
202,the range be very decent,Happy
203,fast service,Happy
204,i would highly recommend this,Happy
205,i would recommend this,Happy
206,i also didnt like the on button,Unhappy
207,bad phone ever,Unhappy
208,im still infatuate with this phone,Happy
209,freeze frequently4,Unhappy
210,it kind of embarrass to use because of how it look and mostly it embarrass how childlike the company be,Unhappy
211,simple,Happy
212,all in all,Unhappy
213,there horrible tick sound in the background on all my call that have never experience before,Unhappy
214,these be certainly very comfortable and functionality be decent,Happy
215,i usually dont like headband but this one be very lightweight doesnt mess up my hair,Happy
216,im bite disappoint,Unhappy
217,i have have this phone for over year now,Unhappy
218,i order this for sony ericsson w8happyunhappyi but think it only work once thats when first use it,Unhappy
219,the battery be completely useless to me,Unhappy
220,what big waste of time,Unhappy
221,dont waste your on this one,Unhappy
222,great sound and service,Happy
223,really please with this product so far,Happy
224,one of my favorite purchase ever,Happy
225,best bluetooth on the market,Happy
226,authentic leather with nice shine and comfort recommend you this case,Happy
227,i be very excite to get this headset because think it be really cute,Happy
228,do not make the same mistake a me,Unhappy
229,big disappointment with calendar sync,Unhappy
230,the phone be unusable and be not new,Unhappy
231,bad customer service ever,Unhappy
232,no additional ear gel provide,Unhappy
233,it defeat the purpose of bluetooth headset,Unhappy
234,worth every penny,Happy
235,excellent wallet type phone case,Happy
236,nice headphone for the price and they work great,Happy
237,internet be excrutiatingly slow,Unhappy
238,it be very comfortable to wear a well,Happy
239,it fit like glove and be strong,Happy
240,o my gosh the best phone have ever have,Happy
241,it very attractive and appear to be of good quality,Happy
242,i love all the feature and form factor,Happy
243,this product have strong rubberpetroleum smell that be unbearable after while and cause me to return it,Unhappy
244,poor quality and service,Unhappy
245,the cable look so thin and flimsy,Unhappy
246,great earpiece,Happy
247,excellent hand free tool,Happy
248,great for use with your home stereo,Happy
249,good product incredible value,Happy
250,only have this month but it work flawlessly so far,Happy
251,work great,Happy
252,absolutel junk,Unhappy
253,that one didnt work either,Unhappy
254,battery life be real good,Happy
255,return 8 hour late,Unhappy
256,it great item,Happy
257,dont waste your money,Unhappy
258,love this headset,Happy
259,not only will it drain your player,Unhappy
260,work perfectly,Happy
261,unreliable im give up,Unhappy
262,i give it 5 star because of the sound quality,Happy
263,avoid this one if you can,Unhappy
264,reversible plug work great,Happy
265,i waste my little money with this earpiece,Unhappy
266,very good phone,Happy
267,best of all be the rotate feature,Happy
268,comfort for our whole family,Happy
269,good product,Happy
270,i love this bluetooth,Happy
271,first of all,Unhappy
272,i be very impress with this headset from plantronics,Happy
273,i get it because it be so small and adorable,Happy
274,great phone,Happy
275,i wouldnt recommend buy this product,Unhappy
276,piece of junk,Unhappy
277,poorly contstruct hinge,Unhappy
278,this item be great,Happy
279,great phone,Happy
280,dont buy it,Unhappy
281,excellent phone,Happy
282,do not purchase this phone,Unhappy
283,the voice recognition thru the handset be excellent,Happy
284,this be hand down the best phone ive ever have,Happy
285,work great,Happy
286,this one work and be price right,Happy
287,customer service be terrible,Unhappy
288,battery life still not long enough in motorola razor v3i,Unhappy
289,send it back,Unhappy
290,now know that make wise decision,Happy
291,someone shouldve invent this sooner,Happy
292,good price,Happy
293,everything work on the first trythe device be certainly engineer in clever way and the construction feel good,Happy
294,i receive it quickly and it work great,Happy
295,have be work great,Happy
296,a many people complain,Unhappy
297,my 5year old nokia 2happy6unhappy from tracfone hold the charge lot good than this,Unhappy
298,they do not care about the consumer one bite,Unhappy
299,this be good battery,Happy
300,the instruction manual be lack,Unhappy
301,also it slim enough to fit into my alarm clock dock station without remove the case,Happy
302,phone now hold charge like it do when it be new,Happy
303,the battery be unreliable a well a the service use antena,Unhappy
304,it uncomfortable and the sound quality be quite poor compare with the phone razr or with my previous wire headset that plug into an lg,Unhappy
305,we have get lot of compliment on it,Happy
306,this be definitely must have if your state do not allow cell phone usage while drive,Happy
307,i want my money back,Unhappy
308,i love this device,Happy
309,i be also very happy with the price,Happy
310,i order this product first and be unhappy with it immediately,Unhappy
311,the ngage be still lack in earbuds,Unhappy
312,i be able to do voice dial in the car with no problem,Happy
313,i have 23 bar on my cell phone when be home,Unhappy
314,good item,Happy
315,howeverthe riingtones be not the best,Unhappy
316,the plug do not work very well,Unhappy
317,amazon suck,Unhappy
318,rip off over charge ship,Unhappy
319,very comfortable,Happy
320,the battery be work well a replacement for the original that come with the phone over 2 year ago,Happy
321,the reception be excellent,Happy
322,it fit comfortably in either ear,Happy
323,very clear,Happy
324,happy long last battery you dont have to recharge it a frequentyly a some of the flip phones2,Unhappy
325,obviously there be problem with the adhesive,Unhappy
326,very disappoint,Unhappy
327,it be an inexpensive piece,Unhappy
328,it be practically useless and do not add any kind of boost to my reception after buy it,Unhappy
329,excellent sound quality,Happy
330,be not happy,Unhappy
331,a piece of junk that break after be on my phone for 2 day,Unhappy
332,new battery work great in phone,Happy
333,bad customer service,Unhappy
334,ive drop my phone more time than can say,Happy
335,reception be terrible and full of static,Unhappy
336,good audio quality,Happy
337,this little device have transform my organizational capability and make my life whole lot easy,Happy
338,i be sit in my vehicle,Unhappy
339,be jerk on the phone,Unhappy
340,work like charm work a advertise,Happy
341,comfortable,Happy
342,their network coverage in los angeles be horrible,Unhappy
343,excellent starter wireless headset,Unhappy
344,the loudspeaker option be great,Unhappy
345,the only thing that think could improve be the sound leak out from the headset,Unhappy
346,first off the reception suck,Unhappy
347,the phone get extremely hot,Unhappy
348,the microphone also work well,Happy
349,nice design and quality,Happy
350,also,Unhappy
351,it be light,Happy
352,bad fit,Unhappy
353,it definitely be not a good a my shappy,Happy
354,awesome device,Happy
355,waste of money,Unhappy
356,i have order motorola data cable,Happy
357,love this phone,Happy
358,i be look for this headset for long time and now that ive get it couldnt be happy,Happy
359,ill be drivng along,Unhappy
360,display be excellent and camera be a good a any from that year,Happy
361,battery life be also great,Happy
362,the bad phone ive ever have only have it for few month,Unhappy
363,not good item it work for while then start have problem in my auto reverse tape player,Unhappy
364,this be so embarassing and also my ear hurt if try to push the ear plug into my ear,Unhappy
365,protect the phone on all side,Happy
366,this be very average phone with bad battery life that operate on weak network,Unhappy
367,clear skype call,Happy
368,soyo technology suck,Unhappy
369,great hand free device,Happy
370,you can even take self portrait with the outside exterior display,Happy
371,same problem a others have mention,Unhappy
372,after try many many handsfree gadget this be the one that finally work well,Happy
373,magical help,Happy
374,the bad piece of crap ever along with the verizon customer service,Unhappy
375,poor sound quality,Unhappy
376,the best phone in market,Happy
377,it work very well,Happy
378,the company ship my product very promptly and it work well,Happy
379,exactly what want,Happy
380,the picture resolution be far below what other comparablypriced phone be offer today,Unhappy
381,this be great deal,Happy
382,excellent product,Happy
383,i highly recommend these and encourage people to give them try,Happy
384,good than youd expect,Happy
385,use all earpiece,Unhappy
386,great product and price,Happy
387,sound good reasonably price and effective,Happy
388,still wait im sure this item would work well if ever recieve it,Unhappy
389,what disappointment,Unhappy
390,very prompt service,Happy
391,excellent product for the price,Happy
392,very please with this headset,Happy
393,dont waste your money and time,Unhappy
394,i especially love the long battery life,Happy
395,it so stupid to have to keep buy new charger,Unhappy
396,work great,Happy
397,plantronics bluetooth excelent buy,Happy
398,i come over from verizon because cingulair have nice cell phone the first thing notice be the really bad service,Unhappy
399,ill be look for new earpiece,Unhappy
400,i highly recommend this device to everyone,Happy
401,jawbone era be awesome too,Happy
402,we receive white color battery that go dead after couple hoursthe original use to last week but still last long than thereplacement,Unhappy
403,after year the battery go completely dead on my headset,Unhappy
404,i have use several phone in two year,Happy
405,an awesome new look for fall 2unhappyunhappyunhappy,Happy
406,this be the first phone ive have that have be so cheaply make,Unhappy
407,att be not clear,Unhappy
408,the plastic break really easy on this clip,Unhappy
409,price be good too,Happy
410,dont make the same mistake do,Unhappy
411,oh and forget to also mention the weird color effect it have on your phone,Unhappy
412,im use it with an iriver spinn with case and it fit fine,Happy
413,also the area where my unit break im not too fond of the magnetic strap,Unhappy
414,overall,Happy
415,every thing on phone work perfectly,Happy
416,it really easy,Happy
417,my sanyo have survive dozen of drop on blacktop without ill effect,Happy
418,fantastic earphone,Happy
419,it find my cell phone right away when enter the car,Happy
420,low quality,Unhappy
421,i highly recommend this modest price cellular phone,Happy
422,but it do get good reception and clarity than any phone ive have before,Happy
423,warn stay away,Unhappy
424,i wish could return the unit and get back my money,Unhappy
425,awsome device work great,Happy
426,i use to talk on it for happy happy happy2 hour and the battery would be literally drain and die,Unhappy
427,if you dont find it,Unhappy
428,very displease,Unhappy
429,i might have get defect,Unhappy
430,they make this case too small and be very difficult to install,Unhappy
431,restore my phone to like new performance,Happy
432,i would recommend purchase the jabra jxhappyunhappy series 2 which work flawlessly with my moto q,Happy
433,i search the internet,Happy
434,do not fit,Unhappy
435,very happy with this product,Happy
436,the screen size be big,Happy
437,there really nothing bad can say about this headset,Unhappy
438,im glad find this product on amazon it be hard to find,Happy
439,portable and it work,Happy
440,my colleague now get great receptiona little expensive,Happy
441,i even fully charge it before go to bed and turn off blue tooth and wifi and notice that it only have 2unhappy leave in the morning,Unhappy
442,ive also have problem with the phone read the memory card in which always turn it on and then off again,Unhappy
443,not good when wear hat or sunglass,Unhappy
444,timely shipment and quality product,Happy
445,nice solid keyboard,Happy
446,very well make and fit my surefire gx2 perfectly,Happy
447,horrible phone,Unhappy
448,bt5unhappy battery junk,Unhappy
449,we would recommend these to others,Happy
450,cant get the software to work with my computer,Unhappy
451,disappoint,Unhappy
452,poor voice clarity,Unhappy
453,the battery work great,Happy
454,no buyer remorse on this one,Unhappy
455,very disappoint in accessoryone,Unhappy
456,i find this inexcusable and so will probably be return this phone and perhaps change carrier,Unhappy
457,look great and be strong,Happy
458,i have have tmobile service for 2 or 3 year now,Happy
459,the update procedure be difficult and cumbersome,Unhappy
460,disappointment hate anything that go in my ear,Unhappy
461,great software for motorolas,Happy
462,the delivery be on time,Happy
463,very easy to use,Happy
464,uncomfortable in the ear,Unhappy
465,the volume switch rocket out of the unit to destination unknown,Unhappy
466,it hold charge for long time,Happy
467,id like to return it,Unhappy
468,the keyboard be really worthwhile in usefulness and be sturdy enough dont expect any problem,Happy
469,verizons bill,Unhappy
470,after charge overnight,Happy
471,you wont regret it,Happy
472,i love this phone,Happy
473,a disappointment,Unhappy
474,it not user friendly,Unhappy
475,unfortunately the ability to actually know you be receive call be rather important feature and this phone be pitiful in that respect,Unhappy
476,then exchange for the same phone,Unhappy
477,this result in the phone be either stick at max volume or mute,Unhappy
478,this pda rock,Happy
479,it be super charge up for use a small hybrid palmtopcameracellphone,Happy
480,i would definitely recommend the jabra bt25unhappyv for those who be look for comfort,Happy
481,i have verizon 2 year ago and really like their service,Happy
482,pretty piece of junk,Unhappy
483,plug be the wrong size,Unhappy
484,work a describe,Happy
485,save your money ive have this item for happy month now,Unhappy
486,bad purchase,Unhappy
487,well im satisfy,Happy
488,the bose noise cancel be amaze,Happy
489,this battery be an excellent bargain,Happy
490,defective crap,Unhappy
491,i would have give no star if be able,Unhappy
492,i wear glass and it fit fine with them,Happy
493,the sound quality for the device be unacceptableunless you be in really quiet area,Unhappy
494,i would not recommend this item to anyone,Unhappy
495,the holster that arrive do not match the photo in the ad,Unhappy
496,greatno problem at all,Happy
497,a an early review note,Unhappy
498,this frog phone charm be adorable and very eye catch,Happy
499,you never know if you push it hard enough or the right number of time for the function you want or not,Unhappy
500,the sound be clear and the people talk to on it be amaze at the quality too,Happy
